<?xml version="1.0"?>
<env xmlns:xsi="http://www.w3.org/2001/XMLSchema-instance" xsi:noNamespaceSchemaLocation="schema/env.xsd">
    <category name="db">
        <arguments type="connection">
            <argument name="host" value="localhost" />
            <argument name="dbname" value="localhost" />
            <argument name="username" value="localhost" />
            <argument name="password" value="localhost" />
            <argument name="table_prefix" value="" />
        </arguments>
        <arguments type="connection">
            <argument name="host" value="localhost" />
            <argument name="dbname" value="localhost" />
            <argument name="username" value="localhost" />
            <argument name="password" value="localhost" />
            <argument name="table_prefix" value="" />
        </arguments>
    </category>
</env>